description,department
Blocking the crosswalk area. Very dangerous for kids crossing.,Police
"The civic service center remains closed during official working hours on multiple occasions.","Municipal Corporation"
"Municipal staff are refusing to accept my application without giving any valid reason.","Municipal Corporation"
"Government hospital has no specialist doctor available for cardiac patients, forcing them to travel long distances for treatment.",Healthcare
"Hospital staff delayed emergency admission despite the patient's critical medical condition.",Healthcare
Lamp post light is shattered and the wires are exposed. This is a serious electrical hazard.,Electricity
"Broken bench in community playground, unsafe for children.",Municipal Corporation
EMERGENCY: ILLEGAL DUMPING AT THE COMMERCIAL INTERSECTION IS BLOCKING THE PEDESTRIAN CROSSING.,Sanitation
"URGENT: A significant water leak near the school entrance is creating a large, slippery pond.",Water Supply
"Water bubbling up through the pavement, looks like a pipe failure.",Water Supply
"Streetlight not functioning, resulting in a dark street section and safety concerns at night.",Electricity
Trash piling up in city center alley.,Sanitation
"Truck parked in a no-parking zone, blocking visibility for turns.",Police
"Overflowing garbage bins at the corner, attracting pests and causing unpleasant odors.",Sanitation
"Small leak from the hydrant, wasting gallons of water.",Water Supply
"Streetlight hasn't been working for weeks, street is pitch black.",Electricity
Loud music from the neighbor's party is rattling my windows.,Police
It's really frustrating that there is loud construction noise occurring well past midnight. This needs attention.,Police
Illegal dumping in the alleyway behind our building.,Sanitation
"Electric poles are dangerously tilted after recent heavy rains.","Electricity"
"School management is not addressing complaints of bullying.","Education"
"Loose electric wires hanging near residential houses are dangerous.","Electricity"
Dumped paint cans in vacant yard.,Sanitation
Old appliances dumped in alley behind 4th St apartments.,Sanitation
"The diagnostic laboratory repeatedly postponed ultrasound appointments without informing patients.",Healthcare
"Patients are not receiving prescribed medicines under the government healthcare scheme due to stock shortages.",Healthcare
Pothole is getting worse every time it rains. It's deep and causing cars to swerve into oncoming traffic.,Roads & Transport
Please look into excessive music volume is coming from the apartment upstairs. I'm concerned about disturbance.,Police
Water leaking from hydrant at the corner of 7th St and Willow Ave.,Water Supply
"The municipal office has rejected my application without providing any explanation.","Municipal Corporation"
"Municipal officials are delaying verification of my building completion certificate.","Municipal Corporation"
"EMERGENCY: A SIGNIFICANT WATER LEAK NEAR THE SCHOOL ENTRANCE IS CREATING A LARGE, SLIPPERY POND.",Water Supply
"Low water pressure all day, and I see water pooling near the curb. Please investigate.",Water Supply
EMERGENCY: THE POTHOLE ON THE MAIN ROAD IS GETTING DEEPER AND I'VE SEEN THREE CARS SWERVE INTO THE OPPOSITE LANE.,Roads & Transport
Dumped tires and construction debris on the vacant lot behind 300 Lincoln Blvd.,Sanitation
Please look into a vehicle is parked right in front of the fire hydrant. I'm concerned about safety.,Police
Constant hum/machinery noise from the nearby site. Very intrusive.,Police
URGENT: The entire block's streetlights are out near the hospital parking zone. It feels extremely unsafe.,Electricity
Garbage bins missing from designated pickup spot.,Sanitation
"The hospital pharmacy frequently runs out of essential medicines, causing inconvenience to patients.",Healthcare
"Hospital staff failed to maintain patient confidentiality by discussing medical records publicly.",Healthcare
"Pothole forming near curb, dangerous for cyclists.",Roads & Transport
"URGENT: A significant water leak near the school entrance is creating a large, slippery pond.",Water Supply
EMERGENCY: THE POTHOLE ON THE MAIN ROAD IS GETTING DEEPER AND I'VE SEEN THREE CARS SWERVE INTO THE OPPOSITE LANE.,Roads & Transport
"I wanted to report that significant water pooling is occurring, possibly a burst pipe. I'm concerned.",Water Supply
Garbage bags left on street after collection day.,Sanitation
There is a serious issue with garbage collection seems to have been missed this week. It's creating problems.,Sanitation
Someone left a pile of old furniture and bags of debris on the corner. It's been there for three days.,Sanitation
"Public park bins are stuffed, litter is everywhere.",Sanitation
Streetlight at the north end of Elm St not working for over a week.,Electricity
"Unexpected electricity disconnections occur even after timely bill payment.","Electricity"
"Students are forced to purchase books from a specific private vendor.","Education"
"Graffiti on the wall of the public library, unsightly for visitors.",Municipal Corporation
"URGENT: Multiple vehicles are double-parked along the main commercial strip, forcing buses to stop.",Police
"Streetlight hasn't been working for weeks, street is pitch black.",Electricity
"Doctors leave the outpatient department before official closing hours, leaving many patients untreated.",Healthcare
"The hospital's online appointment system is frequently unavailable, preventing patients from booking consultations.",Healthcare
"Car parked in front of the driveway, blocking me in.",Police
"URGENT: Constant, high-decibel industrial humming coming from the site next to the apartment complex.",Police
Road surface failure creating a sharp pothole. Please fix.,Roads & Transport
URGENT: Illegal dumping at the commercial intersection is blocking the pedestrian crossing.,Sanitation
"EMERGENCY: MULTIPLE VEHICLES ARE DOUBLE-PARKED ALONG THE MAIN COMMERCIAL STRIP, FORCING BUSES TO STOP.",Police
Trash bags left scattered on crosswalk over the weekend.,Sanitation
Water pooling in the basement/street level. Possible pipe burst underground.,Water Supply
Light is flickering constantly. Very annoying and distracting.,Electricity
Loud music from the neighbor's party is rattling my windows.,Police
"Trash overflowing from the bins, attracting pests and smells.",Sanitation
"Patients are waiting several hours for routine blood sample collection due to insufficient laboratory staff.",Healthcare
"The intensive care unit lacks adequate monitoring equipment for critically ill patients.",Healthcare
EMERGENCY: THE POTHOLE ON THE MAIN ROAD IS GETTING DEEPER AND I'VE SEEN THREE CARS SWERVE INTO THE OPPOSITE LANE.,Roads & Transport
Streetlight pole leaning dangerously after recent storm.,Electricity
"Online municipal portal is not allowing me to download my property tax receipt.","Municipal Corporation"
"Despite paying all municipal taxes, I continue receiving payment reminder notices.","Municipal Corporation"
Construction noise is going on well past midnight.,Police
"EMERGENCY: Multiple vehicles are double-parked along the main commercial strip, forcing buses to stop.",Police
EMERGENCY: THE ENTIRE BLOCK'S STREETLIGHTS ARE OUT NEAR THE HOSPITAL PARKING ZONE. IT FEELS EXTREMELY UNSAFE.,Electricity
Noise from traffic in tunnel exacerbated by ongoing construction.,Police
I wanted to report that garbage collection seems to have been missed this week. Please address this.,Sanitation
"Please look into a vehicle is blocking the sidewalk, forcing pedestrians into the street.",Police
"EMERGENCY: CONSTANT, HIGH-DECIBEL INDUSTRIAL HUMMING COMING FROM THE SITE NEXT TO THE APARTMENT COMPLEX.",Police
Water is bubbling up through the cracks in the sidewalk. It's been like this since yesterday morning.,Water Supply
"Truck parked in a no-parking zone, blocking visibility for turns.",Police
"I've noticed that significant water pooling is occurring, possibly a burst pipe. This has been happening.",Water Supply
The recycling bin is broken and trash is spilling out onto the street. Needs a pickup and replacement.,Sanitation
EMERGENCY: ILLEGAL DUMPING AT THE COMMERCIAL INTERSECTION IS BLOCKING THE PEDESTRIAN CROSSING.,Sanitation
Illegal parking right up against the fire hydrant. This is a huge safety violation.,Police
Illegal dumping in the alleyway behind our building.,Sanitation
"Meter replacement request has not been processed for a faulty electricity meter.","Electricity"
"School library does not have enough textbooks for students.","Education"
"Hospital administration has failed to repair broken patient beds, causing discomfort during treatment.",Healthcare
"The emergency department is overcrowded, resulting in delayed medical attention for accident victims.",Healthcare
Noise from air conditioning units running day and night.,Police
Lamp post light is shattered and the wires are exposed. This is a serious electrical hazard.,Electricity
"EMERGENCY: A SIGNIFICANT WATER LEAK NEAR THE SCHOOL ENTRANCE IS CREATING A LARGE, SLIPPERY POND.",Water Supply
"EMERGENCY: MULTIPLE VEHICLES ARE DOUBLE-PARKED ALONG THE MAIN COMMERCIAL STRIP, FORCING BUSES TO STOP.",Police
URGENT: The pothole on the main road is getting deeper and I've seen three cars swerve into the opposite lane.,Roads & Transport
"URGENT: A significant water leak near the school entrance is creating a large, slippery pond.",Water Supply
EMERGENCY: THE ENTIRE BLOCK'S STREETLIGHTS ARE OUT NEAR THE HOSPITAL PARKING ZONE. IT FEELS EXTREMELY UNSAFE.,Electricity
"Graffiti on the side wall of the Eastside Library, visible from the main road.",Municipal Corporation
"Huge pothole right in the middle of the intersection, almost blew out my tire this morning.",Roads & Transport
"EMERGENCY: A significant water leak near the school entrance is creating a large, slippery pond.",Water Supply
"EMERGENCY: MULTIPLE VEHICLES ARE DOUBLE-PARKED ALONG THE MAIN COMMERCIAL STRIP, FORCING BUSES TO STOP.",Police
Car parked directly in front of my driveway. I have an appointment and cannot get my car out.,Police
"Medical staff failed to provide proper post-surgery care instructions before patient discharge.",Healthcare
"The hospital has inadequate wheelchair access for patients with physical disabilities.",Healthcare
Noise from late-night music in park disturbing nearby residents.,Police
"The municipal office has not updated my address change request in its records.","Municipal Corporation"
"Marriage certificate correction request has remained unresolved for several weeks.","Municipal Corporation"
EMERGENCY: THE POTHOLE ON THE MAIN ROAD IS GETTING DEEPER AND I'VE SEEN THREE CARS SWERVE INTO THE OPPOSITE LANE.,Roads & Transport
EMERGENCY: MULTIPLE VEHICLES ARE DOUBLE-PARKED ALONG THE MAIN COMMERCIAL STRIP FORCING BUSES TO STOP,Roads & Transport
Overflowing public bins at Maple Ave. Trash is being blown all over the sidewalk.,Sanitation
EMERGENCY: THE POTHOLE ON THE MAIN ROAD IS GETTING DEEPER AND I'VE SEEN THREE CARS SWERVE INTO THE OPPOSING LANE.,Roads & Transport
URGENT: Multiple vehicles are double-parked along the main commercial strip forcing buses to stop in traffic.,Roads & Transport
Streetlight flickering intermittently near the bus stop.,Electricity
"Government health center has no laboratory technician available for routine diagnostic tests.",Healthcare
"Patients are being referred to private hospitals because essential diagnostic facilities are unavailable in the government hospital.",Healthcare
"Teachers are skipping classes regularly without any substitute arrangement.","Education"
"Power outages occur daily during business hours affecting small shops.","Electricity"
"School playground is unsafe due to broken equipment and uneven ground.","Education"
Vehicle is parked right in front of the fire hydrant. Please address this as soon as possible.,Police
Small leak coming from the hydrant area. It's wasting a lot of water and needs attention.,Water Supply
URGENT: The entire block's streetlights are out near the hospital parking zone.,Electricity
The pole is leaning and the light is shattered.,Electricity
"Persistent water leak on sidewalk, making it slippery and hazardous.",Water Supply
Streetlight is flickering constantly and is very distracting.,Electricity
Someone left a pile of old furniture and bags of debris on the corner.,Sanitation
Pothole near school drop-off zone causing traffic delays.,Roads & Transport
Streetlight knocked over by vehicle at the intersection.,Electricity
Emergency: Water main break flooding the street.,Water Supply
Noise from leaf blowers on Sunday mornings disrupting sleep.,Municipal Corporation
EMERGENCY: THE ENTIRE BLOCK'S STREETLIGHTS ARE OUT NEAR THE HOSPITAL PARKING ZONE.,Electricity
I've noticed that litter is accumulating in the alleyway and creating a mess.,Sanitation
Broken traffic signal at the junction of 6th Ave and Park Blvd.,Roads & Transport
Streetlight stays on 24/7. Huge waste of electricity.,Electricity
"Hospital staff refused to answer patient queries regarding prescribed medications.",Healthcare
"Diagnostic center uploaded incomplete medical reports, delaying further treatment.",Healthcare
Series of small potholes forming on the curve of Park Ave.,Roads & Transport
My neighbors keep putting their trash out days before collection. The alley is becoming an eyesore.,Sanitation
EMERGENCY: ILLEGAL DUMPING AT THE COMMERCIAL INTERSECTION IS BLOCKING THE PEDESTRIAN CROSSING.,Sanitation
Lens cover is broken on the streetlight. Bulb is exposed.,Electricity
"There is a serious issue with significant water pooling occurring, possibly a burst pipe.",Water Supply
URGENT: A significant water leak near the school entrance is creating a large slippery pond.,Water Supply
"Streetlight broken after car accident, sparking wires noticed.",Electricity
Missing stop sign at intersection.,Roads & Transport
Car parked on the sidewalk forcing pedestrians into the road.,Police
"Frequent transformer failures leave the entire locality without electricity.","Electricity"
"Property ownership details in municipal records are incorrect and need correction.","Municipal Corporation"
"My application for a new house number has not been processed.","Municipal Corporation"
"School toilets are unhygienic and lack regular maintenance.","Education"
"New electricity connection has not been provided despite document verification.","Electricity"
Slight water seepage on the sidewalk. Persistent issue for weeks.,Water Supply
Trash is overflowing from the public bins again. This needs immediate attention.,Sanitation
EMERGENCY: A significant water leak near the school entrance is creating a large slippery pond.,Water Supply
EMERGENCY: THE POTHOLE ON THE MAIN ROAD IS GETTING DEEPER.,Roads & Transport
"Patients are forced to stand in long queues because the hospital has insufficient registration counters.",Healthcare
"The hospital failed to maintain proper cleanliness in maternity wards, creating health risks for mothers and newborns.",Healthcare
Excessive noise from construction crew working well past 10 PM.,Municipal Corporation
Water leaking from a hydrant causing flooding on the sidewalk.,Water Supply
"Large pothole on Main Street near the intersection with Broad St, hazardous for cyclists.",Roads & Transport
"EMERGENCY: CONSTANT, HIGH-DECIBEL INDUSTRIAL HUMMING COMING FROM THE SITE.",Municipal Corporation
Road surface failure creating a sharp pothole.,Roads & Transport
Garbage collected late for the third week in a row.,Sanitation
Broken bench at bus stop needs repair.,Municipal Corporation
Illegal dumping of old furniture observed behind the supermarket parking lot.,Sanitation
Graffiti on the underpass walls looks like gang symbols.,Police
"Graffiti on the wall of the public library, affecting the appearance of the area.",Municipal Corporation
Potholes causing difficulty for cyclists.,Roads & Transport
Garbage truck missed our block again. Overflowing bins are attracting rats.,Sanitation
"Doctors are unavailable during scheduled outpatient hours due to poor duty management.",Healthcare
"The ambulance service could not be contacted because the emergency helpline remained unreachable.",Healthcare
Dangerous crater forming on the side of the road.,Roads & Transport
Graffiti on bus shelter near the high school.,Municipal Corporation
"Industrial fan running 24/7, extremely loud and intrusive.",Municipal Corporation
"Recurring pothole at the intersection, previously filled but has reopened.",Roads & Transport
Pipe burst on the sidewalk. Water has been running for hours.,Water Supply
Noise from nearby construction affecting home office work.,Municipal Corporation
"Flickering light makes it difficult to sleep and unsafe to walk.",Electricity
"Garbage scattered along the median strip of 5th St.",Sanitation
"Nightly music from nearby club disturbing the neighborhood.",Police
"Water leaking from broken pipe in front yard.",Water Supply
"Medical reimbursement has been pending for several months despite submitting all supporting documents.",Healthcare
"Hospital charged additional fees for services that should have been covered under a government healthcare program.",Healthcare
"Road surface is crumbling badly here. Very hazardous for elderly pedestrians crossing.",Roads & Transport
"URGENT: The entire block's streetlights are out near the hospital parking zone. It feels extremely unsafe.","Electricity"
"URGENT: Illegal dumping at the commercial intersection is blocking the pedestrian crossing.","Sanitation"
"Noise from nearby highway construction throughout the night.","Municipal Corporation"
"Frequent low voltage prevents household appliances from functioning properly.","Electricity"
"Teachers frequently use mobile phones during classroom sessions.","Education"
"Electricity connection application has been pending for several months.","Electricity"
"Students are being punished physically by a teacher.","Education"
"Building plan approval has been pending for months without any valid reason.","Municipal Corporation"
"Mutation of my property ownership has not been updated in municipal records.","Municipal Corporation"
"There's a constant stream of water coming from the storm drain, even though it hasn't rained in days.","Water Supply"
"Overflowing garbage bins on the corner are attracting pests and causing unpleasant odors.","Sanitation"
"Delivery truck is blocking the bike lane again. Forces cyclists into the path of speeding cars.","Police"
"Manhole cover is rattling loudly whenever a car drives over it, and the area around it is caved in.","Roads & Transport"
"EMERGENCY: THE POTHOLE ON THE MAIN ROAD IS GETTING DEEPER AND I'VE SEEN THREE CARS SWERVE INTO THE OPPOSITE LANE.","Roads & Transport"
"URGENT: The entire block's streetlights are out near the hospital parking zone. It feels extremely unsafe.","Electricity"
"URGENT: Illegal dumping at the commercial intersection is blocking the pedestrian crossing.","Sanitation"
"I've noticed that cars are illegally parked in a no-parking zone. Please address this as soon as possible.","Police"
"Van parked in the bike lane, very dangerous for commuters.","Police"
"The vaccination center cancelled appointments without prior notification to beneficiaries.",Healthcare
"Hospital staff misplaced patient prescriptions, forcing repeat consultations and additional expenses.",Healthcare
"Garbage truck missed our block again. Overflowing bins are attracting rats, and the smell is unbearable.","Sanitation"
"Pipe burst on the sidewalk. Water has been running for hours, creating a massive ice patch.","Water Supply"
"Trash is overflowing from the public bins again. This has been happening for days.","Sanitation"
"The recycling bin is broken and trash is spilling out onto the street. Needs a pickup and replacement.","Sanitation"
"URGENT: Multiple vehicles are double-parked along the main commercial strip, forcing buses to stop.","Police"
"Water pooling in the basement/street level. Possible pipe burst underground.","Water Supply"
"Significant water pooling is occurring, possibly a burst pipe.","Water Supply"
"Construction crew is starting their work at 5 AM. It is way too loud and violating city ordinances.","Municipal Corporation"
"Garbage bags left outside apartment building despite scheduled pickup.","Sanitation"
"Water is seeping from a broken pipe near the park entrance, creating muddy conditions.","Water Supply"
"Two streetlights out on Walnut St, causing a dark stretch at night.","Electricity"
"Graffiti on the public restroom exterior walls.","Municipal Corporation"
"School laboratory lacks essential equipment for practical classes.","Education"
"Power restoration takes several hours after minor faults.","Electricity"
"School management is demanding unauthorized fees from parents.","Education"
"The diagnostic laboratory reported incorrect test values, requiring patients to undergo repeat testing.",Healthcare
"Patients with chronic illnesses are unable to receive regular follow-up care due to doctor shortages.",Healthcare
"Manhole cover is rattling loudly whenever a car drives over it, and the area around it is caved in.","Roads & Transport"
"Bulb burned out weeks ago, city hasn't replaced it despite previous reports.","Electricity"
"Small but sharp pothole that is definitely going to pop someone's tire.","Roads & Transport"
"Emergency: Water main break flooding the street.","Water Supply"
"Flooding on the street is making it impossible to cross.","Roads & Transport"
"My application for a trade license renewal has been pending for several weeks.","Municipal Corporation"
"The municipal office has delayed issuing my shop establishment certificate.","Municipal Corporation"
"The school principal physically harasses students, misbehaves with parents, and threatens to expel children. Immediate disciplinary action is requested.","Education"
"My educational marksheet verification has been pending for a long time despite reaching the education office. Kindly complete the verification process urgently.","Education"
"URGENT: The entire block's streetlights are out near the hospital parking zone. It feels extremely unsafe.","Electricity"
"Trash is overflowing from the public bins again. Please address this as soon as possible.","Sanitation"
"URGENT: A significant water leak near the school entrance is creating a large, slippery pond.","Water Supply"
"Vehicle parked directly in front of the fire hydrant. Big safety risk.","Police"
"Lamp post light is shattered and the wires are exposed. This is a serious electrical hazard.","Electricity"
"EMERGENCY: The entire block's streetlights are out near the hospital parking zone.","Electricity"
"Excessive music volume is coming from the apartment upstairs.","Municipal Corporation"
"The hospital administration ignored complaints regarding malfunctioning air conditioning in patient wards during extreme summer conditions.",Healthcare
"Repeated complaints regarding poor healthcare services have not been addressed by the concerned hospital authorities.",Healthcare
"EMERGENCY: Multiple vehicles are double-parked along the main commercial strip, forcing buses to stop.","Police"
"The school is demanding additional admission and annual fees that appear unreasonable and place financial burden on parents. Kindly verify the fee structure.","Education"
"There are allegations that government officials handling an education benefit scheme are demanding bribes and deliberately delaying approvals. Kindly investigate.","Education"
"Litter is accumulating in the alleyway and creating a mess.","Sanitation"
"Multiple cars parked on the sidewalk, forcing pedestrians into the street.","Police"
"Power supply is interrupted several times a day in our village.","Electricity"
"School buses are overcrowded, compromising student safety.","Education"
"Electricity meter reading appears incorrect, leading to excess billing.","Electricity"
"Property tax payment is reflecting as pending even after successful online payment.","Municipal Corporation"
"House tax assessment contains incorrect property details and requires correction.","Municipal Corporation"
"URGENT: Multiple vehicles are double-parked along the main commercial strip, forcing buses to stop.","Police"
"The sewer grate is rusted and sunken. It makes a loud clanging noise every time a car drives over it.","Roads & Transport"
"URGENT: Constant, high-decibel industrial humming coming from the site next to the apartment complex.","Municipal Corporation"
"Loud party noise from neighbors past midnight.","Municipal Corporation"
"EMERGENCY: The entire block's streetlights are out near the hospital parking zone.","Electricity"
"EMERGENCY: Constant, high-decibel industrial humming coming from the site next to the apartment complex.","Municipal Corporation"
"The school is charging excessive fees beyond the amount communicated during admission. Kindly investigate the unauthorized fee collection.","Education"
"The school is forcing parents to purchase additional applications, magazines, and other unnecessary items as part of compulsory textbook packages, increasing educational expenses.","Education"
"The school management forces parents to purchase notebooks and study materials only from the school at inflated prices. Kindly investigate this practice.","Education"
"Hospital failed to provide timely emergency treatment due to shortage of medical staff.",Healthcare
"The government hospital does not have sufficient ventilators for critically ill patients.",Healthcare
"Residents are putting out trash on the wrong days, and it's piling up in front of my driveway.","Sanitation"
"URGENT: The pothole on the main road is getting deeper and I've seen three cars swerve.","Roads & Transport"
"Multiple potholes forming on the main road, posing danger to cyclists and vehicles.","Roads & Transport"
"Constant noise from the HVAC units at the new commercial building.","Municipal Corporation"
