description,department
Water leakage near my house,Water Supply
No water supply for two days,Water Supply
Broken water pipeline,Water Supply
Street lights are not working,Electricity
Power cut for five hours,Electricity
Electric pole damaged,Electricity
Garbage not collected for a week,Sanitation
Overflowing dustbin,Sanitation
Road is full of potholes,Roads & Transport
Bridge damaged,Roads & Transport
Traffic signal not working,Roads & Transport
Theft reported in my locality,Police
Street fight during night,Police
Government hospital has no doctor,Healthcare
Ambulance arrived very late,Healthcare
School building is damaged,Education
Teacher absent for many days,Education
"Violence in certain areas has escalated, with frequent clashes between groups causing unrest.",Police
"Garbage is not being collected regularly, leading to unsanitary conditions in the neighborhood.",Sanitation
Road accidents have increased due to lack of proper traffic signals and potholes on the main road.,Roads & Transport
"Incomplete laboratory report with missing diagnostic analysis is delaying medical diagnosis and treatment.","Healthcare"
"Diagnostic laboratory conducted unnecessary medical tests without informed consent and charged an excessive amount.","Healthcare"
"Roads in the area are severely damaged, causing frequent accidents and inconvenience to commuters.",Roads & Transport
Increased risk of theft and accidents at night.",Police
"Reports of rape and sexual violence have shaken the community, demanding immediate action.",Police
"Water supply is inconsistent, and the water quality is poor, posing health risks to residents.",Water Supply
"Cases of road rage have been reported, highlighting the need for stricter traffic regulations.",Police
"The drainage system is inadequate, causing waterlogging during rains and spreading diseases.",Sanitation
"Theft incidents have increased in residential areas, and police patrolling is inadequate.",Police
Frequent chain snatching incidents in the area have created fear among residents.,Police
"Diagnostic test report has not been provided even after the promised delivery time despite repeated follow-ups.","Healthcare"
"Home blood test appointment was not conducted and customer support failed to respond. Requesting refund.","Healthcare"
"An unrecognized school is operating classes beyond its approved level without adequate laboratories, library, playground, qualified teachers, or proper sanitation facilities. Kindly take strict action.","Education"
"A school is forcing parents to purchase expensive notebooks directly from the institution instead of allowing outside purchases. Kindly investigate.","Education"
"Schools in the district are facing a shortage of teachers, affecting the quality of education.",Education
Unauthorized money lenders are harassing locals with exorbitant interest rates and threats.,Police
"Cyber frauds are on the rise, with victims losing significant amounts of money to scams.",Police
"Air pollution levels are extremely high due to nearby industrial activities, affecting public health.",Municipal Corporation
Power goes off every night and no one fixes it.,Electricity
"Vaccination certificate is unavailable because the vaccine was registered with an incorrect mobile number. Requesting correction and certificate issuance.","Healthcare"
Electricity bills are too high and the service is terrible.,Electricity
Our streetlights have not worked for months.,Electricity
"Hospital charged excessive fees, provided poor treatment, and overbilled the patient. Requesting investigation.","Healthcare"
"Requesting deployment of a medical team to investigate the increasing number of dengue and cancer cases in the village.","Healthcare"
They keep rejecting my Aadhaar documents without any reason.,Municipal Corporation
The ration shop is always closed or out of stock.,Municipal Corporation
We didn’t have electricity for two full days last week.,Electricity
The electric poles are damaged and dangerous.,Electricity
Complaints are raised but no action is taken regarding electricity.,Electricity
There's no proper electricity supply in rural areas.,Electricity
Doctors don’t come on time at our local hospital.,Healthcare
There’s no proper medicine supply in government clinics.,Healthcare
We had to wait for hours and no one responded.,Healthcare
Cleanliness in government hospitals is very poor.,Healthcare
"There are allegations that the school principal demanded an illegal payment for student admission and behaved disrespectfully toward parents. Kindly investigate.","Education"
"An unaffiliated school is operating illegally without meeting basic government safety and infrastructure standards. Immediate inspection and action are requested.","Education"
Hospital staff is uncooperative and careless.,Healthcare
Emergency services are not available during night hours.,Healthcare
Frequent voltage fluctuations damage our appliances.,Electricity
The transformer in our area is not working properly.,Electricity
Load shedding happens without any notice.,Electricity
Vaccines are out of stock at the primary health center.,Healthcare
Lab test reports are delayed without reason.,Healthcare
No ambulance is available even during emergencies.,Healthcare
Hospital charges for services that are supposed to be free.,Healthcare
"The municipal complaint submitted through the online portal has remained unattended for over a month.","Municipal Corporation"
"Municipal authorities have not responded to my RTI application regarding civic records.","Municipal Corporation"
"I applied for my ration card two months ago, but there has been no response yet.",Municipal Corporation
The Aadhaar center staff is rude and not helpful.,Municipal Corporation
Aadhaar correction takes too long and no one guides us.,Municipal Corporation
"Government hospital has an insufficient number of doctors, resulting in long waiting hours for patients.",Healthcare
"Hospital staff behaved rudely and refused to provide proper assistance during emergency treatment.",Healthcare
Old people face trouble during biometric verification.,Municipal Corporation
The system is always down when we visit the Aadhaar office.,Municipal Corporation
Ration is not distributed fairly in our area.,Municipal Corporation

"Essential medicines are frequently unavailable at the government hospital pharmacy.",Healthcare
"Diagnostic laboratory delayed the medical test report beyond the promised delivery time.",Healthcare
The helpline number is always busy or unreachable.,Municipal Corporation
The roads are full of potholes and very dangerous.,Roads & Transport
Government buses are always late and the bus stops are in poor condition.,Roads & Transport
"There’s no proper public transport facility in our village.",Roads & Transport
Road repair work was started but never completed.,Roads & Transport
"Incorrect laboratory report caused unnecessary delay in medical treatment.",Healthcare
"Hospital charged excessive fees for services that were never provided.",Healthcare
Roadside drains are broken and create traffic problems.,Roads & Transport
Auto rickshaws overcharge passengers and no action is taken.,Roads & Transport
"The public park in our locality has broken benches that have not been repaired.","Municipal Corporation"
"Children's play equipment in the municipal park is damaged and unsafe.","Municipal Corporation"
"There’s no footpath for pedestrians in busy areas.",Roads & Transport
Traffic lights are not working properly.,Roads & Transport
"Ambulance service arrived several hours late during a medical emergency.",Healthcare
"Hospital washrooms are unhygienic and lack proper sanitation facilities.",Healthcare
Public transport is overcrowded and poorly maintained.,Roads & Transport
Government buses do not stop at their scheduled stops.,Roads & Transport
Garbage is not picked up regularly in our area.,Sanitation
There is a foul smell due to open drains.,Sanitation
The dustbins are always overflowing.,Sanitation
"Patients are forced to wait for several hours before receiving medical consultation.",Healthcare
"Hospital refused to admit a critically ill patient without advance payment.",Healthcare
Mosquitoes and flies are increasing due to poor cleanliness.,Sanitation
The sweeper never comes to our street.,Sanitation
"Power supply has been interrupted every evening for the past week without any prior notice.","Electricity"
"The birth certificate application submitted online has been pending verification for over a month.","Municipal Corporation"
"Government hospital pharmacy is out of essential blood pressure medicines.","Healthcare"
"Our school has not issued transfer certificates despite repeated requests.","Education"
"The municipal water supply has been unavailable in our locality for the last three days.","Water Supply"
"Garbage collection vehicles have not visited our colony for five consecutive days.","Sanitation"
"A motorcycle was stolen from outside my residence during the night.","Police"
"A deep pothole on the main road has caused several two-wheeler accidents.","Roads & Transport"
"Voltage fluctuations are damaging household appliances every night.","Electricity"
"The occupancy certificate for my completed house has not been issued.","Municipal Corporation"
"The ambulance arrived more than one hour after the emergency call.","Healthcare"
"Teachers frequently miss scheduled classes without arranging substitutes.","Education"
"Dirty water is coming through household water connections.","Water Supply"
"Overflowing community garbage bins are attracting stray animals.","Sanitation"
"I lost my wallet and need to register a theft complaint.","Police"
"Traffic signals at the busy junction have remained non-functional for several days.","Roads & Transport"
"The electricity meter installed at my house is recording unusually high readings.","Electricity"
"My property tax payment is not reflected in the municipal portal.","Municipal Corporation"
"The diagnostic laboratory delayed my blood test report by four days.","Healthcare"
"The school has delayed distributing scholarship funds to eligible students.","Education"
"A leaking underground pipeline is wasting drinking water continuously.","Water Supply"
"Sewage water is overflowing onto residential streets.","Sanitation"
"Fraudsters cheated me through an online banking scam.","Police"
"The city bus service frequently skips scheduled stops.","Roads & Transport"
"A damaged transformer is causing repeated power interruptions.","Electricity"
"The municipal office has not corrected my address in civic records.","Municipal Corporation"
"The government health center has no doctor available during working hours.","Healthcare"
"Students are being charged unauthorized examination fees.","Education"
"Our area has received no water tanker despite severe water shortage.","Water Supply"
"Blocked roadside drains are causing stagnant wastewater.","Sanitation"
"My mobile phone was snatched while walking near the market.","Police"
"Broken road dividers are creating dangerous driving conditions.","Roads & Transport"
"The electricity department has not replaced a burnt service cable.","Electricity"
"My application for a trade license renewal remains pending.","Municipal Corporation"
"The hospital postponed my scheduled surgery without explanation.","Healthcare"
"The school administration has not issued my migration certificate.","Education"
"Low water pressure makes it impossible to fill household storage tanks.","Water Supply"
"Public toilets in the market area are extremely dirty.","Sanitation"
"I am receiving threatening phone calls from an unknown person.","Police"
"The road surface has deteriorated badly after recent rains.","Roads & Transport"
"The electricity bill includes charges despite prolonged power outages.","Electricity"
"My request for a house number allotment has not been processed.","Municipal Corporation"
"The primary health center lacks basic vaccination facilities.","Healthcare"
"The school library remains closed throughout the academic session.","Education"
"The overhead water tank in our locality has not been filled today.","Water Supply"
"Garbage is dumped regularly near the community entrance.","Sanitation"
"My parked bicycle was stolen from outside the railway station.","Police"
"Road lane markings have completely faded near the highway.","Roads & Transport"
"Electric poles in our street are leaning dangerously.","Electricity"
"The municipal citizen service center keeps delaying document verification.","Municipal Corporation"
"Essential medicines are unavailable at the government dispensary.","Healthcare"
"Several classrooms do not have functioning ceiling fans.","Education"
"The public tap near our locality has stopped supplying water.","Water Supply"
"Street cleaning has not been carried out for more than a week.","Sanitation"
"Someone has created a fake social media profile using my photographs.","Police"
"The bridge expansion joint is damaged and causing unsafe driving conditions.","Roads & Transport"
"The transformer emits sparks during rainfall.","Electricity"
"The municipal online portal fails every time I submit my application.","Municipal Corporation"
"Patients are waiting several hours before being examined by doctors.","Healthcare"
"The school has not announced board practical examination schedules.","Education"
"The water supplied every morning has a strong unpleasant odor.","Water Supply"
"Household garbage remains uncollected despite regular complaints.","Sanitation"
"My vehicle was vandalized while parked outside my office.","Police"
"Broken speed breakers are causing vehicles to lose control.","Roads & Transport"
"The electricity department has not repaired a snapped distribution wire.","Electricity"
"The completion certificate for my building has not been approved.","Municipal Corporation"
"The hospital has postponed diagnostic tests due to equipment failure.","Healthcare"
"Students have not received their original mark sheets from the institution.","Education"
"Water supply timings are irregular and unpredictable.","Water Supply"
"Open sewage drains are emitting foul smells near homes.","Sanitation"
"My missing document complaint has not been acknowledged by the police.","Police"
"The service road is blocked because of damaged pavement.","Roads & Transport"
"Frequent short circuits are occurring in the neighborhood electrical network.","Electricity"
"The municipal office has not updated my property ownership details.","Municipal Corporation"
"The emergency ward lacks available beds for incoming patients.","Healthcare"
"The school has not provided laboratory access for practical classes.","Education"
"The municipal water pipeline burst has reduced supply across the locality.","Water Supply"
"Community waste collection points are overflowing every evening.","Sanitation"
"My complaint regarding repeated neighborhood harassment has not been acted upon.","Police"
"The road shoulder has eroded, making driving unsafe.","Roads & Transport"
Open urinals are not cleaned properly.,Sanitation
Stray animals roam near garbage dumps.,Sanitation
"Doctor did not explain the diagnosis or treatment plan properly to the patient.",Healthcare
"Medical staff ignored repeated requests for assistance during hospitalization.",Healthcare
The drains are clogged causing water to overflow onto the roads.,Sanitation
No proper waste segregation is being followed.,Sanitation
We have requested fogging several times but it has not been done.,Sanitation
There has been no water supply in my area for three days.,Water Supply
The tap water is muddy and smells bad.,Water Supply
"The municipal garden has overgrown vegetation and requires proper maintenance.","Municipal Corporation"
"Decorative fountains in the public park have remained non-functional for several months.","Municipal Corporation"
"The municipal community hall booking process is unnecessarily delayed.","Municipal Corporation"
"We get water only once a week, causing serious inconvenience.",Water Supply
"Prescribed medicines are consistently unavailable at the hospital pharmacy.",Healthcare
"Hospital demanded unnecessary diagnostic tests, increasing the treatment cost.",Healthcare
"My educational marksheet has not been verified on DigiLocker despite repeated requests. The concerned education authority is not responding.","Education"
"Students are requesting the reopening of offline classes after weather conditions improved because prolonged online classes are affecting learning and health.","Education"
Water pressure is so low that we cannot fill our storage tanks.,Water Supply
The water supply is irregular and unpredictable.,Water Supply
"Blood sample was collected, but the laboratory failed to provide the test report.",Healthcare
"Vaccination certificate contains incorrect details and has not been corrected despite multiple requests.",Healthcare
Our colony has not received clean drinking water in weeks.,Water Supply
Water tankers are not arriving on time.,Water Supply
People are falling sick due to contaminated drinking water.,Water Supply
Despite repeated complaints the water supply issue remains unresolved.,Water Supply
There has been a water leakage on our street for several days.,Water Supply
"Unauthorized late-night party with amplified sound. Need someone to stop this.",Police
Deep pothole near the bus stop making it dangerous for commuters.,Roads & Transport
"Construction crew is starting their work at 5 AM. It is way too loud and violating city ordinances.",Police
"Government should take immediate action to revive the school, as quality education is a fundamental right of every citizen of India.","Education"
"Private schools are being allowed to open without proper policy, leading to a sharp decline in enrollment in government schools. The government should strengthen public education.","Education"
A significant water leak near the school entrance is creating a large slippery pond.,Water Supply
A small pothole near our area is getting deeper every day and becoming dangerous.,Roads & Transport
The entire block's streetlights are out near the hospital parking zone.,Electricity
"The community hall maintenance is poor and basic facilities are unavailable.","Municipal Corporation"
"The municipal office has not processed my request for a vendor license.","Municipal Corporation"
Standing water remains on the road for days after rain because the storm drain is blocked.,Sanitation
Uncollected recycling bins have been left on the curb for three days.,Sanitation
Constant high-decibel industrial humming from the nearby construction site is disturbing residents.,Police
Multiple small potholes are causing traffic to slow down significantly.,Roads & Transport
"Multiple vehicles are double-parked along the commercial street, blocking buses and creating traffic.",Roads & Transport
A huge pothole in the middle of the intersection almost damaged my vehicle.,Roads & Transport
"The drainage cover is missing or broken, creating a hazard for vehicles.",Sanitation
Overflowing dumpster behind the grocery store is creating unhygienic conditions.,Sanitation
A leaking fire hydrant is wasting a large amount of water.,Water Supply
"Primary Health Centre remains closed during official working hours.",Healthcare
"Hospital equipment required for diagnosis has been non-functional for several weeks.",Healthcare
Illegal dumping of old tires in the alley needs immediate cleanup.,Sanitation
"Garbage collection appears to have been missed this week, causing waste to pile up.",Sanitation
A massive pothole on River Road damaged my vehicle and needs urgent repair.,Roads & Transport
Illegal dumping at a busy intersection is blocking the pedestrian crossing.,Sanitation
A major water main leak is flooding the road and causing water pressure issues.,Water Supply
"Two streetlights on the residential street are not working, making the area unsafe at night.",Electricity
Large pothole at the intersection is forcing vehicles to swerve dangerously.,Roads & Transport
"The storm drain is partially collapsed and blocked with heavy debris, increasing flood risk.",Sanitation
Graffiti has been painted on the public restroom wall in the city park.,Municipal Corporation
"Patient discharge was delayed unnecessarily due to administrative negligence.",Healthcare
"Online pharmacy marked medicines as delivered even though they were never received.",Healthcare
Illegal dumping of furniture and appliances on the sidewalk needs immediate removal.,Sanitation
Garbage scattered after the storm requires urgent cleanup.,Sanitation
"My application for an advertisement display permit has been pending for a long time.","Municipal Corporation"
"Several public notice boards maintained by the municipality are damaged and unreadable.","Municipal Corporation"
A pothole on the main road is getting deeper and creating a serious accident risk.,Roads & Transport
A sharp pothole may damage vehicle tires if not repaired soon.,Roads & Transport
"Garbage collection has been missed this week, and waste is accumulating.",Sanitation
The streetlight is flickering continuously and needs repair.,Electricity
The bike rack outside the public library is damaged and unusable.,Municipal Corporation
"Refund for cancelled medical appointment has not been processed.",Healthcare
"Hospital staff demanded unofficial payments before providing treatment.",Healthcare
"Someone has parked on the sidewalk, forcing pedestrians onto the road.",Roads & Transport
Overflowing garbage bins at the park entrance require immediate collection.,Sanitation
Overflowing public bins on Sunset Boulevard are spreading trash across the sidewalk.,Sanitation
"Pregnant women are not receiving timely maternity care at the health center.",Healthcare
"Emergency department lacks sufficient beds for incoming patients.",Healthcare
The public waste container is completely full and needs an additional collection.,Sanitation
A vehicle with an extremely loud engine keeps circling the neighborhood repeatedly.,Police
"Construction work is continuing well past midnight, creating excessive noise.",Police
"A private school has violated government holiday orders by conducting offline classes during officially declared school closures. Kindly take appropriate action.","Education"
Loud bass-heavy music from a nearby apartment has become a persistent disturbance.,Police
An industrial fan has been running continuously and creating excessive noise.,Police
"Hospital administration lost important patient medical records.",Healthcare
"Laboratory collected the wrong sample, requiring the patient to undergo testing again.",Healthcare
"I submitted the application fee for the TGT Science recruitment three times because the payment confirmation did not appear. A total of ₹1500 was deducted instead of ₹500. Despite repeated reminders, the excess ₹1000 has not been refunded for over five months.","Education"
"Multiple vehicles are double-parked along the main commercial strip, blocking buses and disrupting traffic.",Roads & Transport
A small pothole is getting deeper every day and needs immediate repair.,Roads & Transport
Standing water remains on the road after rain because the storm drain is not working.,Sanitation
"Street name boards in our locality are missing, making navigation difficult.","Municipal Corporation"
"House numbering in our colony is inconsistent and requires correction by the municipality.","Municipal Corporation"
"The entire block's streetlights are out near the hospital, making the area unsafe.",Electricity
"A vehicle is parked directly in front of a fire hydrant, creating a serious safety hazard.",Roads & Transport
Constant high-decibel industrial noise from a nearby site is disturbing residents.,Police
"The storm drain has partially collapsed and is blocked with heavy debris, increasing flood risk.",Sanitation
"A teacher deliberately targeted and failed a student after a personal disagreement, causing harassment and affecting academic performance.","Education"
"The school does not provide adequate sports facilities or opportunities for students to participate in competitions despite repeated requests.","Education"
A huge pothole in the middle of the intersection is damaging vehicles.,Roads & Transport
"Power supply goes off every afternoon for nearly two hours.","Electricity"
"The municipal office has not issued my marriage certificate despite document verification.","Municipal Corporation"
"The doctor was absent from the primary health center during official working hours.","Healthcare"
"The school has not returned students' original documents after admission cancellation.","Education"
"Residents have not received drinking water through pipelines for four consecutive days.","Water Supply"
"Garbage has accumulated near the apartment entrance because collection vehicles have stopped visiting.","Sanitation"
"My laptop was stolen from my hostel room and the theft needs investigation.","Police"
"The flyover approach road has developed large cracks making travel unsafe.","Roads & Transport"
"High voltage fluctuations have damaged my refrigerator.","Electricity"
"My request for correction in property tax records has not been processed.","Municipal Corporation"
"The hospital laboratory lost my blood sample and asked me to provide another sample.","Healthcare"
"The college administration has delayed issuing my degree certificate.","Education"
"Water supplied to our locality contains excessive mud and suspended particles.","Water Supply"
"Drainage water is overflowing near residential houses creating foul smell.","Sanitation"
"My ATM card was stolen and unauthorized withdrawals have been made.","Police"
"The traffic signal timer at the main intersection is malfunctioning.","Roads & Transport"
"The electricity department has not replaced the damaged service transformer.","Electricity"
"My application for property mutation is pending without any update.","Municipal Corporation"
