description,department
"The government hospital has postponed my diagnostic scan due to machine failure.","Healthcare"
"The school has not declared annual examination results on time.","Education"
"The municipal water pipeline has developed multiple leakages in our street.","Water Supply"
"Community garbage bins have remained uncleared for over a week.","Sanitation"
"I am receiving repeated threatening messages from an unknown number.","Police"
"The city bus service is frequently cancelled without prior notice.","Roads & Transport"
"Frequent fuse failures are disrupting electricity in our neighborhood.","Electricity"
"My application for building completion certificate has been delayed.","Municipal Corporation"
"The health center has run out of anti-rabies vaccines.","Healthcare"
"The school has not provided practical examination records to students.","Education"
"There is no drinking water supply during the scheduled morning hours.","Water Supply"
"Sewage water has entered residential compounds after rainfall.","Sanitation"
"My vehicle was stolen from the public parking area.","Police"
"The service lane has severe surface damage making it difficult for vehicles.","Roads & Transport"
"The electricity pole outside my house has visible structural cracks.","Electricity"
"The municipal portal is not allowing me to update my property details.","Municipal Corporation"
"The emergency department is refusing to admit critically ill patients due to staff shortage.","Healthcare"
"The school has not issued bonafide certificates required for scholarship applications.","Education"
"The overhead municipal water tank has not been cleaned for a long time.","Water Supply"
"Public waste containers remain uncovered and attract stray animals.","Sanitation"
"Someone has forged my signature on official documents.","Police"
"The road shoulder has collapsed after heavy rainfall.","Roads & Transport"
"My electricity connection application has been pending for several weeks.","Electricity"
"The municipal office has not updated my corrected date of birth in civic records.","Municipal Corporation"
"The hospital pharmacy has no insulin available for diabetic patients.","Healthcare"
"Students are unable to access the computer laboratory because it remains locked.","Education"
"The public water tap has been dry for the last five days.","Water Supply"
"Garbage collection staff have skipped our residential area repeatedly.","Sanitation"
"My identity documents have been stolen and misused.","Police"
"Damaged crash barriers on the bridge have not been repaired.","Roads & Transport"
"Power restoration takes several hours after every minor fault.","Electricity"
"The municipal citizen help desk refuses to accept complete applications.","Municipal Corporation"
"The diagnostic center provided an incomplete medical report.","Healthcare"
"The institution has delayed issuing internship completion certificates.","Education"
"Drinking water supply is interrupted every alternate day.","Water Supply"
"Solid waste has piled up near the marketplace causing inconvenience.","Sanitation"
"My online fraud complaint has not received any investigation update.","Police"
"Several road reflectors are missing on the highway at night.","Roads & Transport"
"The electricity bill includes charges for a disconnected connection.","Electricity"
"The municipal office has misplaced my building approval documents.","Municipal Corporation"
"The government clinic has insufficient staff to handle patients.","Healthcare"
"The school has not updated attendance records correctly.","Education"
"Residents are receiving water only for fifteen minutes every morning.","Water Supply"
"The roadside public toilet has not been maintained for several weeks.","Sanitation"
"My motorcycle registration documents were stolen.","Police"
"The road median is broken and creating traffic hazards.","Roads & Transport"
"Loose electrical wires are hanging from distribution poles.","Electricity"
"My trade license application has been rejected without explanation.","Municipal Corporation"
"The hospital delayed issuing my discharge summary.","Healthcare"
"The school has not refunded the security deposit after graduation.","Education"
"The municipal water pipeline burst has disrupted supply in multiple streets.","Water Supply"
"Open garbage heaps have remained unattended despite complaints.","Sanitation"
"My passport was stolen and I need to register a complaint.","Police"
"The damaged culvert is creating unsafe driving conditions.","Roads & Transport"
"Power outages increase every evening during peak hours.","Electricity"
"The municipal office has not processed my application for house number correction.","Municipal Corporation"
"The blood bank has insufficient stock for emergency patients.","Healthcare"
"The examination hall allocation was not communicated to students.","Education"
"Water supplied through the pipeline has an unusual smell.","Water Supply"
"The drain cleaning request has not been attended for several weeks.","Sanitation"
"My complaint regarding financial fraud has not been investigated.","Police"
"The main road has uneven pavement causing frequent vehicle damage.","Roads & Transport"
"Doctor was absent during scheduled consultation hours without prior notice.",Healthcare
"Medical insurance claim has been pending for several months without justification.",Healthcare
Graffiti on a public building is making the area look neglected.,Municipal Corporation
Litter is accumulating in the alleyway because garbage is not being collected regularly.,Sanitation
Graffiti with inappropriate words has been painted on the playground slide.,Municipal Corporation
"A vehicle is blocking the sidewalk, forcing pedestrians onto the road.",Roads & Transport
"Water is leaking from a broken pipe beneath the sidewalk, creating slippery conditions.",Water Supply
A leaking fire hydrant is wasting a large amount of water.,Water Supply
A broken bench in the public playground needs repair.,Municipal Corporation
"Dialysis services are frequently unavailable due to equipment malfunction.",Healthcare
"Patients with disabilities are unable to access hospital facilities because of poor infrastructure.",Healthcare
An abandoned vehicle has been occupying street parking for weeks.,Roads & Transport
A constant stream of water is flowing from the storm drain even without rain.,Water Supply
"A water main has burst under the sidewalk, causing continuous flooding.",Water Supply
Water leaking from a hydrant is flooding the street.,Water Supply
"The municipal records contain duplicate entries for my property.","Municipal Corporation"
"The municipal office has not updated my grievance status despite repeated follow-ups.","Municipal Corporation"
"Garbage collection was missed, causing overflowing bins and attracting rats.",Sanitation
"The school is demanding a donation amount significantly higher than the fee published on its official website. Parents are also being charged additional amounts under various names.","Education"
"Teachers frequently humiliate students, interfere in their personal matters, and misuse their authority, creating a hostile learning environment.","Education"
Trash is overflowing from public bins in the park and spreading everywhere.,Sanitation
"Hospital failed to maintain proper hygiene in patient wards, increasing infection risk.",Healthcare
"Medical examination was postponed repeatedly without providing any valid reason.",Healthcare
The streetlight remains on during the day but turns off at night.,Electricity
A car parked in front of my driveway is preventing me from leaving.,Roads & Transport
Water is pooling along the curb because it is not draining into the storm sewer.,Sanitation
Illegal dumping at a commercial intersection is blocking the pedestrian crossing.,Sanitation
"Construction work is continuing well past midnight, causing excessive noise.",Police
"The drainage cover is missing, creating a danger for pedestrians.",Sanitation
The pothole on the main road is getting deeper and creating an accident risk.,Roads & Transport

A large blockage in the storm drain pipe is causing water to back up.,Sanitation
"The complaint acknowledgement was generated, but no municipal officer has visited the location.","Municipal Corporation"
"Tree pruning request submitted to the municipal office has not been acted upon.","Municipal Corporation"
"Hospital pharmacy supplied medicines close to their expiry date.",Healthcare
"Blood bank reported shortages, delaying emergency surgeries.",Healthcare
A barking dog is creating continuous noise throughout the day and night.,Police
A foul sewer smell is coming from the drainage system and needs immediate cleaning.,Sanitation
Overflowing public bins on Maple Avenue are spreading trash across the sidewalk.,Sanitation
A significant water leak near the school entrance has created a large slippery pond.,Water Supply
A pothole on the main road has expanded and is damaging vehicle tires.,Roads & Transport
"A school principal physically punished a student without hearing both sides of an incident and failed to address continued bullying afterward.","Education"
"The school principal is pressuring parents to withdraw their child from the school without valid reasons. Immediate intervention is requested.","Education"
A streetlight near the school entrance is not working.,Electricity
"Government health center does not have adequate medical staff for rural patients.",Healthcare
"Patient was discharged without receiving complete medical reports.",Healthcare
"Streetlight is flickering and sometimes turns off, reducing visibility at night.",Electricity
"Several streetlights on the block are not working, creating a security risk for residents.",Electricity
Constant high-decibel industrial humming from a nearby construction site is disturbing residents.,Police
A deep pothole outside the gas station is creating a safety hazard.,Roads & Transport
Illegal dumping at a commercial intersection is blocking the pedestrian crossing.,Sanitation
"A van is parked in the bike lane, creating a danger for commuters.",Roads & Transport
"Several old trees in the public park require maintenance to prevent accidents.","Municipal Corporation"
"The municipal office has delayed issuing the occupancy certificate for my completed building.","Municipal Corporation"
"Multiple cars are parked on the sidewalk, forcing pedestrians onto the road.",Roads & Transport
"The storm drain has partially collapsed and is blocked with heavy debris, increasing the risk of flooding.",Sanitation
"Residents are putting out garbage on the wrong collection days, causing trash to pile up.",Sanitation
A burst pipe on the sidewalk has been leaking water for hours and creating hazardous conditions.,Water Supply
"Hospital billed duplicate charges for the same medical procedure.",Healthcare
"Medical laboratory uploaded incomplete diagnostic reports.",Healthcare
"School staff behaved rudely over the phone and repeatedly disconnected calls instead of providing information requested by parents.","Education"
"The school management has poor administration, unreasonable timings for young children, and does not provide services matching the high fees charged.","Education"
Excessively loud music from a nearby apartment is disturbing the neighborhood.,Police
The pothole on the main road is getting deeper and creating a serious accident risk.,Roads & Transport
Construction noise late at night is disturbing nearby residents.,Police
The streetlight stays on during the day but turns off at night and needs repair.,Electricity
A significant water leak near the school entrance has created a large slippery pond.,Water Supply
A deep pothole is causing traffic slowdowns and endangering cyclists.,Roads & Transport
"Doctor prescribed treatment without conducting a proper examination.",Healthcare
"Hospital elevators remained out of service, causing hardship for elderly patients.",Healthcare
"A streetlight near the corner is not working, leaving the area poorly lit.",Electricity
Water is bubbling up through cracks in the sidewalk due to an underground leak.,Water Supply
"A truck is parked in a no-parking zone, blocking visibility for turning vehicles.",Roads & Transport
A car parked on the sidewalk is forcing pedestrians onto the road.,Roads & Transport
Noise from an ongoing street festival is preventing residents from sleeping.,Police
"The municipal citizen service center staff behaved unprofessionally while processing my application.","Municipal Corporation"
"The school is demanding illegal donations and additional admission charges without issuing proper receipts. Kindly investigate the fee collection practices.","Education"
"A teacher does not teach the syllabus properly, unfairly awards marks, and shows bias against students. Kindly investigate the teacher's conduct.","Education"
Someone dumped an old mattress and a broken television on the sidewalk.,Sanitation
Graffiti has been sprayed on the side wall of a coffee shop overnight.,Municipal Corporation
A pothole near the bus stop is damaging vehicle tires.,Roads & Transport
"Hospital registration process is extremely slow due to poor management.",Healthcare
"Patients are required to purchase basic medical supplies from private stores because the hospital has no stock.",Healthcare
"A vehicle is blocking the sidewalk, forcing pedestrians into the street.",Roads & Transport
A massive pothole has damaged vehicle wheels and requires urgent repair.,Roads & Transport
A streetlight outage at a busy intersection is creating unsafe driving conditions.,Electricity
Water leaking from a hydrant is flooding the street.,Water Supply
The storm drain is clogged with leaves and debris and may cause flooding during rain.,Sanitation
Large pothole forming near the intersection causing vehicles to swerve unexpectedly.,Roads & Transport
Noise from delivery trucks idling early morning in a residential zone.,Police
"Streetlight out on the corner again. It's pitch black at night and I don't feel safe walking my dog.",Electricity
Streetlight leaning dangerously after the recent storm.,Electricity
"Water isn't draining after the storm, creating a massive pool in front of the school entrance.",Sanitation
"Van has been abandoned for weeks with a flat tire, taking up valuable parking space.",Police
Old mattresses have been dumped near the recycling center.,Sanitation
"Emergency: Water main break flooding the street.",Water Supply
"There is a deep, jagged pothole on the turn of 5th and Main, making it dangerous, especially at night.",Roads & Transport
"The school principal frequently misbehaves with parents and refuses to resolve genuine grievances regarding school administration.","Education"
"A teacher has not received the full salary despite completing assigned duties. Repeated requests to the school administration have been ignored.","Education"
Damaged park fencing has become a safety hazard for children.,Municipal Corporation
Abandoned mattress and bags of trash have been left beside the railroad tracks.,Sanitation
"Hospital repeatedly postponed scheduled surgery without medical justification.",Healthcare
"Emergency helpline failed to respond during a medical emergency.",Healthcare
"Manhole cover rattles loudly whenever vehicles pass over it, and the surrounding road surface is caved in.",Roads & Transport
Water is leaking into the basement from the street side due to a city water line issue.,Water Supply
"Truck blocking the driveway. I can't get my car out to go to work.",Police
"Small pothole turning into a larger crater. Should be patched before it gets worse.",Roads & Transport
"Water leaking into the basement from the street side. Notified the landlord but it looks like a city water line issue.",Water Supply
"Leaking water main near the school entrance.",Water Supply
"Electricity supply is interrupted several times during the night causing inconvenience.","Electricity"
"My application for a birth certificate correction has not been processed for over a month.","Municipal Corporation"
"The government hospital has no pediatric specialist available during working hours.","Healthcare"
"The school has not issued identity cards to newly admitted students.","Education"
"The municipal water supply has stopped without any prior notice.","Water Supply"
"Garbage has remained scattered around the public collection point for several days.","Sanitation"
"My handbag containing important documents was stolen from a public bus.","Police"
"The approach road to our village has developed deep cracks.","Roads & Transport"
"The transformer near our locality is making loud buzzing noises.","Electricity"
"My application for property name transfer is still pending.","Municipal Corporation"
"The hospital delayed my laboratory reports beyond the promised date.","Healthcare"
"The school has postponed practical examinations without informing students.","Education"
"The public drinking water tap has very low water pressure.","Water Supply"
"Overflowing garbage containers have become a breeding ground for flies.","Sanitation"
"My lost mobile complaint has not been updated by the police.","Police"
"The pedestrian crossing markings near the school have completely faded.","Roads & Transport"
"The electricity department has not replaced the damaged distribution box.","Electricity"
"The municipal office has entered incorrect details in my property records.","Municipal Corporation"
"There are no wheelchairs available for elderly patients at the hospital.","Healthcare"
"The college has delayed issuing provisional certificates.","Education"
"Residents are receiving muddy water through household connections.","Water Supply"
"The roadside garbage collection point has not been cleaned this week.","Sanitation"
"My ATM card was stolen and someone attempted unauthorized transactions.","Police"
"The city road shoulder has sunk after recent rainfall.","Roads & Transport"
"Power restoration is delayed even after faults are repaired.","Electricity"
"My application for municipal building records has not been approved.","Municipal Corporation"
"The government clinic is running without essential diagnostic equipment.","Healthcare"
"The school has not distributed textbooks even after the academic session started.","Education"
"The municipal water pipeline has developed a leak near our apartment.","Water Supply"
"Public waste bins are damaged and unusable.","Sanitation"
"My vehicle registration documents were stolen from my car.","Police"
"The road surface near the bridge is uneven and dangerous.","Roads & Transport"
"The electricity connection frequently trips due to faulty infrastructure.","Electricity"
"The municipal office has delayed issuing my occupancy certificate.","Municipal Corporation"
"The emergency ward has insufficient nursing staff.","Healthcare"
"The school has not refunded caution money after course completion.","Education"
"Water supply timings change daily without any announcement.","Water Supply"
"Household garbage collection has become irregular in our colony.","Sanitation"
"I want to report repeated threatening messages received through social media.","Police"
"The divider reflectors on the highway are missing.","Roads & Transport"
"The electricity bill includes incorrect meter readings.","Electricity"
"My request for correction in municipal tax assessment has not been resolved.","Municipal Corporation"
"The hospital has postponed my scheduled diagnostic procedure.","Healthcare"
"The school management has delayed issuing fee receipts.","Education"
"The public water storage tank is not being filled regularly.","Water Supply"
"Garbage dumped near residential buildings has not been removed.","Sanitation"
"My bicycle was stolen from the public parking stand.","Police"
"The service road has multiple broken concrete slabs.","Roads & Transport"
"The electricity pole outside the market is severely tilted.","Electricity"
"The municipal grievance portal always shows my complaint as pending.","Municipal Corporation"
"The government hospital pharmacy has no stock of asthma inhalers.","Healthcare"
"The institution has not updated student attendance records correctly.","Education"
"The municipal water supply is available for less than twenty minutes daily.","Water Supply"
"Open waste collection points are causing inconvenience to nearby residents.","Sanitation"
"My complaint regarding document theft has not received any update.","Police"
"Several road signs near the junction are damaged.","Roads & Transport"
"The transformer fuse keeps blowing during peak hours.","Electricity"
"The municipal office has misplaced my submitted application.","Municipal Corporation"
"The laboratory has not uploaded my diagnostic reports online.","Healthcare"
"The school has not announced internal assessment results.","Education"
"The drinking water supplied has an unpleasant taste.","Water Supply"
"Roadside litter has not been cleared despite repeated complaints.","Sanitation"
"My purse was stolen while travelling in a crowded market.","Police"
"The village road has become difficult to use due to surface damage.","Roads & Transport"
"The electricity department has not repaired the damaged junction box.","Electricity"
"The municipal office has delayed verification of my civic records.","Municipal Corporation"
"The health center has no ECG machine available.","Healthcare"
"The school has delayed issuing migration certificates.","Education"
"The municipal water valve remains closed beyond scheduled timings.","Water Supply"
"Community garbage bins are overflowing every morning.","Sanitation"
"My complaint regarding cyber impersonation has not progressed.","Police"
"The damaged culvert is making vehicle movement unsafe.","Roads & Transport"
"Electricity outages increase whenever it rains.","Electricity"
"My application for a municipal trade certificate is awaiting approval.","Municipal Corporation"
"The hospital has cancelled outpatient appointments without notice.","Healthcare"
"The school has not provided laboratory equipment for science practicals.","Education"
"The municipal water connection delivers only a weak flow.","Water Supply"
"Garbage collection vehicles are skipping our lane regularly.","Sanitation"
"My complaint about repeated phone harassment has not been investigated.","Police"
"The highway shoulder is eroding and requires immediate repairs.","Roads & Transport"
"Water pooling on the curb, not draining into the storm sewer.",Sanitation
"Constant water bubbling up from under the pavement. Looks like a main pipe leak and is wasting water.",Water Supply
"Pothole is getting worse every time it rains. It's deep and causing cars to swerve into oncoming traffic.",Roads & Transport
"Deep pothole forming near the school zone, dangerous for buses and students.",Roads & Transport
"Garbage collection seems to have been missed this week.",Sanitation
"The school accepted admission and registration fees despite failing to verify eligibility and later denied admission without refunding the amount.","Education"
"A student with dyslexia was denied admission to the preferred stream despite meeting eligibility criteria, while other students with lower marks were accommodated.","Education"
"Trash overflowing from the bins, attracting pests and foul smells.",Sanitation
"Deep crater in the road, extremely dangerous for cyclists.",Roads & Transport
"Illegal dumping of electronics in a vacant lot.",Sanitation
"Loud music at night coming from a nearby club.",Police
"Online consultation service deducted payment but no doctor consultation was provided.",Healthcare
"Medical reimbursement request has not been processed despite submitting all required documents.",Healthcare
"Litter is accumulating in the alleyway, creating a mess.",Sanitation
"Car parked on the sidewalk, forcing pedestrians into the road.",Police
"Water leaking from a pipe in the alley, creating a visible puddle.",Water Supply
"Public waste container is completely full and needs an extra collection.",Sanitation
"Car parked directly in front of my driveway. I have an appointment and cannot get my car out.",Police
"Low water pressure throughout the day, with water pooling near the curb.",Water Supply
"Barking dogs left unattended for hours in the backyard, causing excessive noise.",Police
"Pothole on the right-hand lane causing tire damage to several vehicles.",Roads & Transport
"Water leak at city park restrooms.",Water Supply
"Unusually loud vehicle engine noise repeatedly circling the block.",Police
"The school timing for kindergarten students begins too early, causing stress for both children and parents. Kindly review the schedule.","Education"
"A school principal insulted a parent over pending fees and publicly humiliated them instead of providing reasonable support.","Education"
"Streetlight flickers, sometimes goes completely dark.",Electricity
"Barking dogs left unattended for hours in the backyard. Extremely disruptive.",Police
"Hospital refused to issue medical certificates required for official purposes.",Healthcare
"Public health center lacks clean drinking water for patients and attendants.",Healthcare
"Small pothole turning into a larger crater. Should be patched before it gets worse.",Roads & Transport
"URGENT: The entire block's streetlights are out near the hospital parking zone. It feels extremely unsafe for pedestrians.",Electricity
"Emergency: Water main break flooding the street.",Water Supply
"EMERGENCY: THE POTHOLE ON THE MAIN ROAD IS GETTING DEEPER AND I'VE SEEN THREE CARS SWERVE INTO THE OPPOSITE LANE.",Roads & Transport
"Broken bench in the park near the playground, potential safety hazard for children.",Municipal Corporation
"Loud construction noise every morning before 7am.",Police
"It's really frustrating that litter is accumulating in the alleyway and creating a mess. This needs attention.",Sanitation
